{
  "schema_version": "0.1.0",
  "kind": "as-built-spec",
  "generated_at": "2026-10-15T10:00:00.000Z",
  "tool": {
    "name": "product-check",
    "version": "0.1.0"
  },
  "target": {
    "name": "Vibe Notes (synthetic demo)",
    "repository": "Vibe Notes (synthetic demo)",
    "commit": "56b23fac439176b4ea0666b96854350a82606ec6",
    "ref": "refs/heads/main"
  },
  "surface": [
    {
      "id": "SRF-FF548D40E5",
      "kind": "page",
      "name": "/",
      "method": null,
      "area": "home",
      "detail": "Next.js app router page",
      "location": {
        "path": "app/page.tsx",
        "line": 1
      },
      "certainty": "observed",
      "auth_hint": false,
      "evidence_ids": [
        "EV-18C86403D062"
      ]
    },
    {
      "id": "SRF-60C87FBF12",
      "kind": "page",
      "name": "/privacy",
      "method": null,
      "area": "privacy",
      "detail": "Next.js app router page",
      "location": {
        "path": "app/privacy/page.tsx",
        "line": 1
      },
      "certainty": "observed",
      "auth_hint": false,
      "evidence_ids": [
        "EV-E568CBDC3327"
      ]
    },
    {
      "id": "SRF-828B758920",
      "kind": "endpoint",
      "name": "/api/notes",
      "method": "GET",
      "area": "notes",
      "detail": "Next.js route handler",
      "location": {
        "path": "app/api/notes/route.ts",
        "line": 2
      },
      "certainty": "observed",
      "auth_hint": false,
      "evidence_ids": [
        "EV-3E91936747FD"
      ]
    },
    {
      "id": "SRF-5AFD64FD47",
      "kind": "endpoint",
      "name": "/api/summarize",
      "method": "POST",
      "area": "summarize",
      "detail": "Next.js route handler",
      "location": {
        "path": "app/api/summarize/route.ts",
        "line": 3
      },
      "certainty": "observed",
      "auth_hint": false,
      "evidence_ids": [
        "EV-DF85655B0058"
      ]
    },
    {
      "id": "SRF-3C538D65B0",
      "kind": "entity",
      "name": "Note",
      "method": null,
      "area": "data",
      "detail": "SQL table",
      "location": {
        "path": "prisma/migrations/0001_init/migration.sql",
        "line": 1
      },
      "certainty": "observed",
      "auth_hint": false,
      "evidence_ids": [
        "EV-68298607ED35"
      ]
    },
    {
      "id": "SRF-E9D314193A",
      "kind": "entity",
      "name": "Note",
      "method": null,
      "area": "data",
      "detail": "fields: id, owner, html",
      "location": {
        "path": "prisma/schema.prisma",
        "line": 5
      },
      "certainty": "observed",
      "auth_hint": false,
      "evidence_ids": [
        "EV-1FBE61E84F69"
      ]
    },
    {
      "id": "SRF-BCBF6383D2",
      "kind": "config",
      "name": "DATABASE_URL",
      "method": null,
      "area": "configuration",
      "detail": "server-side; 1 reference(s)",
      "location": {
        "path": "lib/db.ts",
        "line": 2
      },
      "certainty": "observed",
      "auth_hint": false,
      "evidence_ids": [
        "EV-1D15C006C286"
      ]
    },
    {
      "id": "SRF-49D7263530",
      "kind": "config",
      "name": "NEXT_PUBLIC_SUPABASE_URL",
      "method": null,
      "area": "configuration",
      "detail": "exposed to the browser bundle; 1 reference(s)",
      "location": {
        "path": "lib/supabase-server.ts",
        "line": 3
      },
      "certainty": "observed",
      "auth_hint": false,
      "evidence_ids": [
        "EV-65B1DCB2C813"
      ]
    },
    {
      "id": "SRF-F95F56750B",
      "kind": "config",
      "name": "OPENAI_API_KEY",
      "method": null,
      "area": "configuration",
      "detail": "server-side; 1 reference(s)",
      "location": {
        "path": "app/api/summarize/route.ts",
        "line": 2
      },
      "certainty": "observed",
      "auth_hint": false,
      "evidence_ids": [
        "EV-73D36908E083"
      ]
    },
    {
      "id": "SRF-1DEE72DA0B",
      "kind": "config",
      "name": "SUPABASE_SERVICE_ROLE_KEY",
      "method": null,
      "area": "configuration",
      "detail": "server-side; 1 reference(s)",
      "location": {
        "path": "lib/supabase-server.ts",
        "line": 3
      },
      "certainty": "observed",
      "auth_hint": false,
      "evidence_ids": [
        "EV-73871D143FA4"
      ]
    },
    {
      "id": "SRF-9DAA994B65",
      "kind": "integration",
      "name": "@supabase/supabase-js",
      "method": null,
      "area": "data",
      "detail": "data",
      "location": {
        "path": "package.json",
        "line": 10
      },
      "certainty": "observed",
      "auth_hint": false,
      "evidence_ids": [
        "EV-EAB7FB65417F"
      ]
    },
    {
      "id": "SRF-693E60FD29",
      "kind": "integration",
      "name": "openai",
      "method": null,
      "area": "ai",
      "detail": "ai",
      "location": {
        "path": "package.json",
        "line": 11
      },
      "certainty": "observed",
      "auth_hint": false,
      "evidence_ids": [
        "EV-313843BF192C"
      ]
    },
    {
      "id": "SRF-0155DC3160",
      "kind": "integration",
      "name": "prisma",
      "method": null,
      "area": "data",
      "detail": "data",
      "location": {
        "path": "package.json",
        "line": 12
      },
      "certainty": "observed",
      "auth_hint": false,
      "evidence_ids": [
        "EV-637D6B1FAFEE"
      ]
    },
    {
      "id": "SRF-21C4B40109",
      "kind": "test",
      "name": "authz: anonymous requests to /api/notes are rejected",
      "method": null,
      "area": "tests/security",
      "detail": "test title",
      "location": {
        "path": "tests/security/authz.test.mjs",
        "line": 15
      },
      "certainty": "inferred",
      "auth_hint": false,
      "evidence_ids": [
        "EV-E344694CEDB8"
      ]
    },
    {
      "id": "SRF-6895711B9E",
      "kind": "test",
      "name": "onboarding: a new user can sign up and create a first note",
      "method": null,
      "area": "tests/e2e",
      "detail": "test title",
      "location": {
        "path": "tests/e2e/onboarding.test.mjs",
        "line": 15
      },
      "certainty": "inferred",
      "auth_hint": false,
      "evidence_ids": [
        "EV-4C0325B2E116"
      ]
    },
    {
      "id": "SRF-F6E62EC5F2",
      "kind": "test",
      "name": "unit: summary input is clipped to 4000 characters",
      "method": null,
      "area": "tests/unit",
      "detail": "test title",
      "location": {
        "path": "tests/unit/summarize.test.mjs",
        "line": 4
      },
      "certainty": "inferred",
      "auth_hint": false,
      "evidence_ids": [
        "EV-C133E23FCFE5"
      ]
    }
  ],
  "stories": [
    {
      "id": "US-1",
      "area": "home",
      "title": "Home and top-level pages",
      "critical_journey": null,
      "surface_ids": [
        "SRF-FF548D40E5"
      ],
      "requirement_ids": [
        "FR-001"
      ],
      "test_behaviours": []
    },
    {
      "id": "US-2",
      "area": "notes",
      "title": "Notes",
      "critical_journey": "Sign up and create a first note",
      "surface_ids": [
        "SRF-828B758920",
        "SRF-21C4B40109",
        "SRF-6895711B9E"
      ],
      "requirement_ids": [
        "FR-002"
      ],
      "test_behaviours": [
        "authz: anonymous requests to /api/notes are rejected",
        "onboarding: a new user can sign up and create a first note"
      ]
    },
    {
      "id": "US-3",
      "area": "privacy",
      "title": "Privacy",
      "critical_journey": null,
      "surface_ids": [
        "SRF-60C87FBF12"
      ],
      "requirement_ids": [
        "FR-003"
      ],
      "test_behaviours": []
    },
    {
      "id": "US-4",
      "area": "summarize",
      "title": "Summarize",
      "critical_journey": "Summarize a note with AI",
      "surface_ids": [
        "SRF-5AFD64FD47",
        "SRF-F6E62EC5F2"
      ],
      "requirement_ids": [
        "FR-004"
      ],
      "test_behaviours": [
        "unit: summary input is clipped to 4000 characters"
      ]
    }
  ],
  "requirements": [
    {
      "id": "FR-001",
      "statement": "The system MUST serve the page `/`.",
      "certainty": "observed",
      "surface_ids": [
        "SRF-FF548D40E5"
      ],
      "evidence_ids": [
        "EV-18C86403D062"
      ]
    },
    {
      "id": "FR-002",
      "statement": "The system MUST handle `GET` requests to `/api/notes`.",
      "certainty": "observed",
      "surface_ids": [
        "SRF-828B758920"
      ],
      "evidence_ids": [
        "EV-3E91936747FD"
      ]
    },
    {
      "id": "FR-003",
      "statement": "The system MUST serve the page `/privacy`.",
      "certainty": "observed",
      "surface_ids": [
        "SRF-60C87FBF12"
      ],
      "evidence_ids": [
        "EV-E568CBDC3327"
      ]
    },
    {
      "id": "FR-004",
      "statement": "The system MUST handle `POST` requests to `/api/summarize`.",
      "certainty": "observed",
      "surface_ids": [
        "SRF-5AFD64FD47"
      ],
      "evidence_ids": [
        "EV-DF85655B0058"
      ]
    },
    {
      "id": "FR-005",
      "statement": "The system MUST persist `Note` records (fields: id, owner, html; defined in 2 places).",
      "certainty": "observed",
      "surface_ids": [
        "SRF-3C538D65B0",
        "SRF-E9D314193A"
      ],
      "evidence_ids": [
        "EV-1FBE61E84F69",
        "EV-68298607ED35"
      ]
    },
    {
      "id": "FR-006",
      "statement": "The system MUST integrate with `@supabase/supabase-js` (data).",
      "certainty": "observed",
      "surface_ids": [
        "SRF-9DAA994B65"
      ],
      "evidence_ids": [
        "EV-EAB7FB65417F"
      ]
    },
    {
      "id": "FR-007",
      "statement": "The system MUST integrate with `openai` (ai).",
      "certainty": "observed",
      "surface_ids": [
        "SRF-693E60FD29"
      ],
      "evidence_ids": [
        "EV-313843BF192C"
      ]
    },
    {